mysql> Show Databases;
+--------------------+
| Database           |
+--------------------+
| information_schema |
| mysql              |
| performance_schema |
| sys                |
+--------------------+
4 rows in set (0.03 sec)

mysql> use mysql
Reading table information for completion of table and column names
You can turn off this feature to get a quicker startup with -A

Database changed
mysql> create table uSquare(id tinyint primary key,name varchar(30) not null,roll tinyint unique not null,age tinyint check(age>=1) not null);
Query OK, 0 rows affected (0.04 sec)

mysql> desc uSquare;
+-------+-------------+------+-----+---------+-------+
| Field | Type        | Null | Key | Default | Extra |
+-------+-------------+------+-----+---------+-------+
| id    | tinyint     | NO   | PRI | NULL    |       |
| name  | varchar(30) | NO   |     | NULL    |       |
| roll  | tinyint     | NO   | UNI | NULL    |       |
| age   | tinyint     | NO   |     | NULL    |       |
+-------+-------------+------+-----+---------+-------+
4 rows in set (0.01 sec)

mysql> create table United(roll tinyint primary key,name varchar(20) not null,id tinyint,marks tinyint default 0,foreign key(id) references uSquare(id));
Query OK, 0 rows affected (0.06 sec)

mysql>  desc United;
+-------+-------------+------+-----+---------+-------+
| Field | Type        | Null | Key | Default | Extra |
+-------+-------------+------+-----+---------+-------+
| roll  | tinyint     | NO   | PRI | NULL    |       |
| name  | varchar(20) | NO   |     | NULL    |       |
| id    | tinyint     | YES  | MUL | NULL    |       |
| marks | tinyint     | YES  |     | 0       |       |
+-------+-------------+------+-----+---------+-------+
4 rows in set (0.00 sec)

mysql> insert into uSquare values(1,"Deepak",1,12);
Query OK, 1 row affected (0.04 sec)

mysql> insert into uSquare values(2,"Deepak",2,12);
Query OK, 1 row affected (0.01 sec)

mysql> insert into United(roll,name,marks) values(1,"Meenu",100);
Query OK, 1 row affected (0.00 sec)

mysql> select * from United;
+------+-------+------+-------+
| roll | name  | id   | marks |
+------+-------+------+-------+
|    1 | Meenu | NULL |   100 |
+------+-------+------+-------+
1 row in set (0.00 sec)

mysql> select * from uSquare;
+----+--------+------+-----+
| id | name   | roll | age |
+----+--------+------+-----+
|  1 | Deepak |    1 |  12 |
|  2 | Deepak |    2 |  12 |
+----+--------+------+-----+
2 rows in set (0.00 sec)

mysql> insert into United(roll,name,marks) values(4,"Meenu",100);
Query OK, 1 row affected (0.04 sec)

mysql> insert into United values(6,"Deepak",1,100);
Query OK, 1 row affected (0.03 sec)

mysql>  alter table uSquare change roll roll tinyint auto_increment;
Query OK, 2 rows affected (0.08 sec)
Records: 2  Duplicates: 0  Warnings: 0

mysql> insert into uSquare(id,name,age) values(5,"Aishu",12);
Query OK, 1 row affected (0.03 sec)

mysql> select * from United;
+------+--------+------+-------+
| roll | name   | id   | marks |
+------+--------+------+-------+
|    1 | Meenu  | NULL |   100 |
|    4 | Meenu  | NULL |   100 |
|    6 | Deepak |    1 |   100 |
+------+--------+------+-------+
3 rows in set (0.00 sec)

mysql>  select * from uSquare;
+----+--------+------+-----+
| id | name   | roll | age |
+----+--------+------+-----+
|  1 | Deepak |    1 |  12 |
|  2 | Deepak |    2 |  12 |
|  5 | Aishu  |    3 |  12 |
+----+--------+------+-----+
3 rows in set (0.00 sec)

mysql>  delete from uSquare where roll=3;
Query OK, 1 row affected (0.00 sec)

mysql>  insert into uSquare(id,name,age) values(6,"Aishu",12);
Query OK, 1 row affected (0.03 sec)

mysql> select * from uSquare;
+----+--------+------+-----+
| id | name   | roll | age |
+----+--------+------+-----+
|  1 | Deepak |    1 |  12 |
|  2 | Deepak |    2 |  12 |
|  6 | Aishu  |    4 |  12 |
+----+--------+------+-----+
3 rows in set (0.00 sec)

mysql> 


